{
  "PK": "ENG#11111111-1111-4111-8111-111111111111",
  "SK": "STATE",
  "GSI1PK": "TV#33333333-3333-4333-8333-333333333333#v3#S7",
  "GSI1SK": "11111111-1111-4111-8111-111111111111",
  "GSI2PK": "FIRM#22222222-2222-4222-8222-222222222222#S7",
  "GSI2SK": "PENDING#2026-10-22T10:00:05Z#11111111-1111-4111-8111-111111111111",
  "entityType": "EngagementState",
  "engagementId": "11111111-1111-4111-8111-111111111111",
  "firmId": "22222222-2222-4222-8222-222222222222",
  "region": "EU",
  "templateId": "33333333-3333-4333-8333-333333333333",
  "branch": "main",
  "currentVersion": "v3",
  "offerTarget": "v7",
  "offerSince": "2026-10-22T10:00:05Z",
  "offerStatus": "PENDING",
  "previouslyDeclined": [
    "v5"
  ],
  "declineHistory": [
    {
      "declinedVersion": "v5",
      "userId": "44444444-4444-4444-8444-444444444444",
      "summaryId": "55555555-5555-4555-8555-555555555555",
      "decidedAt": "2026-09-01T09:30:00Z"
    }
  ],
  "flags": [],
  "lastSeq": 12,
  "lastHookAt": "2026-09-01T09:30:00Z",
  "version": 4,
  "createdBy": "00000000-0000-4000-8000-000000000001",
  "createdAt": "2026-10-22T10:00:00Z",
  "updatedBy": "00000000-0000-4000-8000-000000000001",
  "updatedAt": "2026-10-22T10:00:05Z",
  "state": "CLASSIFIED"
}
